photo-6.6,5002reca.jpg,Amygdalotome,Amygdalotome,Instrument d'ORL; XX siècle;,"Plusieurs modèles d'instruments très similaires à celui-ci ont existé: pour procéder à une amygdalectomie, il suffit de passer l'extrémité circulaire de l'instrument autour de l'amygdale, maintenue par le petit harpon, puis de tirer la lame pour séctionner la glande.","991023526231202851, 991012066319702851, 991021154529702851, 991009321689702851, 991014206779702851, 991013177049702851",,,
photo-6.7,5004reca.jpg,Miroirs laryngiens,Miroirs laryngiens,Instrument d'ORL; XX siècle;,"Set de miroirs de différentes tailles, à fixer sur un manche, utilisés pour l'examen visuel du larynx. Ce procédé a été développé au cours du XIX siècle.","991022955709702851, 991008231129702851, 991000717159702851, 991023512372302851, 991021363029702851, 991017585139702851",,,
photo-6.8,IHM-0579BD.JPG,Lampe d'éclairage,Lampe d'éclairage,ORL; XX siècle,"Avant l'avènement de l'électricité, c'est avec ce type de lampe à pétrole que l'on s'éclairait pour les examens visuels en ORL. La lumière pouvait être dirigée et réfléchie à l'aide du cylindre de laiton.","991023512465902851, 991001081809702851, 991004279659702851, 991011692849702851, 991003599449702851, 991005467549702851",,,
photo-6.9,IHM-0646.JPG,Pipe de Ticchioni,Pipe de Ticchioni,Dispositif d'ORL; XX siècle,Cet appareil permet d'amplifier la voix d'une personne ayant subi une laryngectomie. Sa forme de pipe permet de faire oublier sa fonction médicale pour l'intégrer aux habitudes quotidiennes du patient.,"991012554689702851, 991023537014302851, 991012197759702851, 991002606939702851, 991002333999702851, 991023489071602851",,,
photo-6.10,IHM-0331reca.jpg,Spéculum nasal de Fränkel,Spéculum nasal de Fränkel,Instrument de diagnostic ORL; XIX siècle; XX siècle,"Inventé en 1872, ce spéculum nasal est composé de deux petites lames arrondies et ajourées. L'écartement se règle par une vis.","991023512465702851, 991023512475702851, 991011532459702851, 991001798039702851, 991009814509702851, 991018136549702851",,,
photo-7.1,IHM-0670,Le Thermogène - ouate révulsive,Le Thermogène - Ouate Révulsive,Pharmacie; XX siècle,"Le pharmacien belge Charles Vandenbroek lance cette ouate révulsive au début du XX siècle, destinée à soigner les douleurs et les affections respiratoires par son action chauffante. Il s'agit en fait d'une ouate enduite de Capsicum frutescens, qui n'est autre qu'une variété de piment.","991004236019702851, 991008805569702851, 991010211479702851, 991021484489702851, 991006885209702851, 991018470499702851",,,
photo-7.2,0151reca.jpg,Trousse de pharmacie,Trousse de pharmacie,Pharmacie; XX siècle,"Cette pharmacie de poche contient une vingtaine de fioles renfermant des substances sous forme liquide ou solide. Elle offre un panorama des molécules synthétisées de l'époque, et couvre un large champ thérapeutique (antipyrétique, analgésique, émétique, laxatif, coagulant, antipaludique, etc.)","991005987279702851, 991009650889702851, 991023515641702851, 991006325009702851, 991020186309702851, 991023578335702851",,,
photo-7.3,0620reca.jpg,Trousse de pharmacie homéopathique,Trousse de pharmacie homéopathique,Pharmacie; XIX siècle,Cette trousse porte la date de 1867 et contient une multitude de tubes  de granules homéopathiques.,"991013655169702851, 991009965979702851, 991022298229702851, 991021976609702851, 991019124959702851, 991015890869702851",,,
photo-7.4,5013reca.jpg,Pilulier,Pilulier,Pharmacie; XIX siècle,"Pour fabriquer des pilules, il faut travailler la masse pilulaire sur la tablette du pilulier, puis en faire un cylindre que l'on place transversalement sur le revêtement cannelé. On y place la règle, cannelée elle aussi, qui permet de couper et former les pilules. On peut achever de les rouler à la main.","991010054619702851, 991017390539702851, 991022246809702851, 991001696079702851, 991020150659702851, 991023424738602851",,,
photo-7.5,5021reca.jpg,Pilon,Pilon,Pharmacie; XX siècle,"Associé au mortier, le pilon permet de réduire en poudre ou en pâte les substances qui entrent dans la composition de médicaments.","991013592259702851, 991011532009702851, 991017010699702851, 991017656969702851, 991020279149702851, 991023496924902851",,,
photo-7.6,IHM-0191reca.jpg,Poudres KAFA,Poudres KAFA,Pharmacie; XX siècle,"Produites par la Pharmacie Principale de Genève, les Poudres Kafa ont été un analgésique très populaire dans la première moitié du XX siècle. Son principe actif, la phénacétine, a été interdit à partir de 1983 car nephrotoxique, et remplacé par le paracétamol.","991023523699002851, 991018094449702851, 991005448019702851, 991008408489702851, 991014623939702851, 991023561030502851",,,
photo-7.7,IHM-0197reca.jpg,Boîte de coton chirurgical,Boîte de coton chirurgical,Pharmacie; XX siècle,Coton chirurgical produit par l'entreprise suisse Flawa.,"991009379249702851, 991009338959702851, 991010385719702851, 991020999309702851, 991009393169702851, 991023438610802851",,,
photo-7.8,IHM-0204reca.jpg,Cachets Kalmine,Cachets Kalmine,Pharmacie; XX siècle,"Mise au point par Paul Métadier, la Kalmine est un analgésique à base de Pyramidon et Phénacétine.","991019968459702851, 991007255279702851, 991022609139702851, 991019631709702851, 991004857119702851, 991014520279702851",,,
photo-7.9,IHM-0224reca.jpg,Boîte de préparation pharmaceutique,Boîte de préparation pharmaceutique,Pharmacie; XX siècle; 1935,Petite boîte utilisée pour le conditionnement des médicaments élaborés en pharmacie.,"991010016209702851, 991005843279702851, 991005796999702851, 991021251649702851, 991010331129702851, 991023523710602851",,,
photo-7.10,IHM-0666reca.jpg,Epanal Un,Epanal Un,Pharmacie; XX siècle,"Elaboré dans les années 1950 par les Laboratoires Bouchara à Paris pour traiter l'insomnie et les états anxieux, ce médicament combine des extraits naturels comme la valériane et la passiflore, avec une mollécule de synthèse, le phénobarbital.","991017564969702851, 991000089119702851, 991001247059702851, 991015224459702851, 991011165389702851, 991023510621702851",,,
